,title,link,pubDate,description
0,The Airlines Most Likely To Lose Your Luggage In The US,https://www.forbes.com/sites/jamesasquith/2020/03/09/the-airlines-most-likely-to-lose-your-luggage-in-the-us/,"Mon, 09 Mar 2020 07:00:00 GMT",The Airlines Most Likely To Lose Your Luggage In The US
1,Delta Sky Clubs set for overhaul,https://www.businesstraveller.com/business-travel/2020/03/09/delta-sky-clubs-set-for-overhaul/,"Mon, 09 Mar 2020 07:00:00 GMT",Delta Sky Clubs set for overhaul – Business Traveller
2,When smoking got banned on planes flying in the US,https://www.businessinsider.com/when-did-smoking-get-banned-on-planes-in-the-us-2020-2,"Sun, 08 Mar 2020 08:00:00 GMT",When smoking got banned on planes flying in the US
3,The Complete Guide to Earning and Using Frequent Flyer Miles,https://www.fool.com/the-ascent/credit-cards/articles/complete-guide-frequent-flyer-miles/,"Sun, 08 Mar 2020 08:00:00 GMT",The Complete Guide to Earning and Using Frequent Flyer Miles
4,United Airlines' INSANE New Schedule Change Policy,https://onemileatatime.com/united-airlines-schedule-change-policy/,"Sun, 08 Mar 2020 08:00:00 GMT",United Airlines' INSANE New Schedule Change Policy
5,LATAM offers coronavirus waivers for international flights,https://www.airlineratings.com/news/latam-offers-coronavirus-waivers-international-flights/,"Mon, 09 Mar 2020 07:00:00 GMT",LATAM offers coronavirus waivers for international flights
