,title,link,pubDate,description
0,Contours of consulting changed with COVID: IBM,https://www.thehindu.com/business/Industry/contours-of-consulting-changed-with-covid-ibm/article37478726.ece,"Sat, 13 Nov 2021 17:02:40 GMT",Contours of consulting changed with COVID: IBM
1,"Smart Retail Market To Witness Huge Growth By 2026 | PAR Technology, IBM, Softbank Robotics Holdings",https://energysiren.co.ke/2021/11/13/smart-retail-market-to-witness-huge-growth-by-2026-par-technology-ibm-softbank-robotics-holdings/,"Sat, 13 Nov 2021 16:07:54 GMT","Smart Retail Market To Witness Huge Growth By 2026 | PAR Technology, IBM, Softbank Robotics Holdings – Energy Siren"
2,"Multichannel Market Global Analysis 2021-2028: RedPoint Global, IBM, Experian, Maropost, Selligent, and Many More.",https://energysiren.co.ke/2021/11/13/multichannel-market-global-analysis-2021-2028-redpoint-global-ibm-experian-maropost-selligent-and-many-more/,"Sat, 13 Nov 2021 16:11:37 GMT","Multichannel Market Global Analysis 2021-2028: RedPoint Global, IBM, Experian, Maropost, Selligent, and Many More. – Energy Siren"
3,"AI Image Recognition Market Global Analysis 2021-2028: Micron Technology Inc., IBM Corporation, Intel Corporation, NVIDIA Corporation, Google LLC, and Many More.",https://energysiren.co.ke/2021/11/13/ai-image-recognition-market-global-analysis-2021-2028-micron-technology-inc-ibm-corporation-intel-corporation-nvidia-corporation-google-llc-and-many-more/,"Sat, 13 Nov 2021 14:56:27 GMT","AI Image Recognition Market Global Analysis 2021-2028: Micron Technology Inc., IBM Corporation, Intel Corporation, NVIDIA Corporation, Google LLC, and Many More. – Energy Siren"
4,"Cognitive Computing Market Rewriting Long Term Growth Story | Microsoft, IBM, Google, Vicarious, Palantir, and Cold Light",https://energysiren.co.ke/2021/11/13/cognitive-computing-market-rewriting-long-term-growth-story-microsoft-ibm-google-vicarious-palantir-and-cold-light/,"Sat, 13 Nov 2021 19:12:52 GMT","Cognitive Computing Market Rewriting Long Term Growth Story | Microsoft, IBM, Google, Vicarious, Palantir, and Cold Light – Energy Siren"
5,"Remote Learning Technology Spending Market Shaping from Growth to Value | IBM, Oracle, Microsoft",http://energysiren.co.ke/2021/11/13/remote-learning-technology-spending-market-shaping-from-growth-to-value-ibm-oracle-microsoft/,"Sat, 13 Nov 2021 08:42:58 GMT","Remote Learning Technology Spending Market Shaping from Growth to Value | IBM, Oracle, Microsoft – Energy Siren"
6,"Econometric Analysis Software Market – Major Technology Giants in Buzz Again | IBM, Eviews, Microsoft",https://energysiren.co.ke/2021/11/14/econometric-analysis-software-market-major-technology-giants-in-buzz-again-ibm-eviews-microsoft/,"Sun, 14 Nov 2021 00:06:05 GMT","Econometric Analysis Software Market – Major Technology Giants in Buzz Again | IBM, Eviews, Microsoft – Energy Siren"
7,"ICT Investment Market Is Going To Boom: Cisco, IBM, Oracle",https://energysiren.co.ke/2021/11/13/ict-investment-market-is-going-to-boom-cisco-ibm-oracle/,"Sat, 13 Nov 2021 15:16:44 GMT","ICT Investment Market Is Going To Boom: Cisco, IBM, Oracle – Energy Siren"
8,"Neuromorphic Computing Systems Market Is Booming Worldwide | IBM Corporation, Numenta, Qualcomm",https://energysiren.co.ke/2021/11/13/neuromorphic-computing-systems-market-is-booming-worldwide-ibm-corporation-numenta-qualcomm/,"Sat, 13 Nov 2021 18:43:40 GMT","Neuromorphic Computing Systems Market Is Booming Worldwide | IBM Corporation, Numenta, Qualcomm – Energy Siren"
9,"IP Software Market Comprehensive Study By Key Players | Clarivate, PatSnap, IBM",http://energysiren.co.ke/2021/11/13/ip-software-market-comprehensive-study-by-key-players-clarivate-patsnap-ibm/,"Sat, 13 Nov 2021 15:19:50 GMT","IP Software Market Comprehensive Study By Key Players | Clarivate, PatSnap, IBM – Energy Siren"
10,"Internet of Nano Things Market Size & Revenue Analysis | Cisco, IBM, Qualcomm",https://energysiren.co.ke/2021/11/13/internet-of-nano-things-market-size-revenue-analysis-cisco-ibm-qualcomm/,"Sat, 13 Nov 2021 18:09:41 GMT","Internet of Nano Things Market Size & Revenue Analysis | Cisco, IBM, Qualcomm – Energy Siren"
11,"Enterprise software Market 2028 Top Vendors: IBM Cloud and Microsoft Azure. Software available on Microsoft Azure includes MQ, Websphere Liberty, DB2, and IBM Pure Application Service. Windows Server and SQL Server will be available on the IBM Clou",https://energysiren.co.ke/2021/11/13/enterprise-software-market-2028-top-vendors-ibm-cloud-and-microsoft-azure-software-available-on-microsoft-azure-includes-mq-websphere-liberty-db2-and-ibm-pure-application-service-windows-ser/,"Sat, 13 Nov 2021 11:06:10 GMT","Enterprise software Market 2028 Top Vendors: IBM Cloud and Microsoft Azure. Software available on Microsoft Azure includes MQ, Websphere Liberty, DB2, and IBM Pure Application Service. Windows Server and SQL Server will be available on the IBM Clou"
12,"Chatbot for Banking Market Future Growth Outlook | LivePerson, Kasisto, IBM",https://energysiren.co.ke/2021/11/13/chatbot-for-banking-market-future-growth-outlook-liveperson-kasisto-ibm/,"Sat, 13 Nov 2021 15:38:03 GMT","Chatbot for Banking Market Future Growth Outlook | LivePerson, Kasisto, IBM – Energy Siren"
13,"File Market May See A Big Move: Condrey, Druva, DataFrameworks, Egnyte, IBM, Formpipe",http://energysiren.co.ke/2021/11/13/file-market-may-see-a-big-move-condrey-druva-dataframeworks-egnyte-ibm-formpipe/,"Sat, 13 Nov 2021 14:42:38 GMT","File Market May See A Big Move: Condrey, Druva, DataFrameworks, Egnyte, IBM, Formpipe – Energy Siren"
14,"Cloud-native Software Market to Witness Huge Growth by 2028 | IBM, Nokia, Onica",https://energysiren.co.ke/2021/11/13/cloud-native-software-market-to-witness-huge-growth-by-2028-ibm-nokia-onica/,"Sat, 13 Nov 2021 11:26:30 GMT","Cloud-native Software Market to Witness Huge Growth by 2028 | IBM, Nokia, Onica – Energy Siren"
15,"API Access Management Market Quality & Quantity Analysis | Okta, Micro Focus, IBM",https://energysiren.co.ke/2021/11/13/api-access-management-market-quality-quantity-analysis-okta-micro-focus-ibm/,"Sat, 13 Nov 2021 12:31:06 GMT","API Access Management Market Quality & Quantity Analysis | Okta, Micro Focus, IBM – Energy Siren"
16,"Network Management Softwares Market Outlook 2021 : Top Key Manufacturers (Broadcom, IBM, NetScout Systems & More) with Leading Regions and Countries Data",http://energysiren.co.ke/2021/11/13/network-management-softwares-market-outlook-2021-top-key-manufacturers-broadcom-ibm-netscout-systems-more-with-leading-regions-and-countries-data/,"Sat, 13 Nov 2021 16:29:35 GMT","Network Management Softwares Market Outlook 2021 : Top Key Manufacturers (Broadcom, IBM, NetScout Systems & More) with Leading Regions and Countries Data – Energy Siren"
17,"Predictive Analytics Market Investment Analysis | IBM, Oracle, SAP",https://energysiren.co.ke/2021/11/13/predictive-analytics-market-investment-analysis-ibm-oracle-sap/,"Sat, 13 Nov 2021 17:55:23 GMT","Predictive Analytics Market Investment Analysis | IBM, Oracle, SAP – Energy Siren"
18,"Data Classification Software Market Quality & Quantity Analysis | Netwrix, Amazon, IBM",https://energysiren.co.ke/2021/11/13/data-classification-software-market-quality-quantity-analysis-netwrix-amazon-ibm/,"Sat, 13 Nov 2021 12:22:11 GMT","Data Classification Software Market Quality & Quantity Analysis | Netwrix, Amazon, IBM – Energy Siren"
19,"Cloud Performance Test Service Market – Major Technology Giants in Buzz Again | IBM, HP, Cray, NUDT, Fujitsu",https://energysiren.co.ke/2021/11/13/cloud-performance-test-service-market-major-technology-giants-in-buzz-again-ibm-hp-cray-nudt-fujitsu/,"Sat, 13 Nov 2021 11:19:25 GMT","Cloud Performance Test Service Market – Major Technology Giants in Buzz Again | IBM, HP, Cray, NUDT, Fujitsu – Energy Siren"
20,"IT Managed Services Market Sets the Table for Continued Growth | IBM, Accenture, Cognizant",https://energysiren.co.ke/2021/11/13/it-managed-services-market-sets-the-table-for-continued-growth-ibm-accenture-cognizant/,"Sat, 13 Nov 2021 06:50:17 GMT","IT Managed Services Market Sets the Table for Continued Growth | IBM, Accenture, Cognizant – Energy Siren"
21,"Big Data Security Market to Eyewitness Massive Growth by 2029 | IBM, Hewlett Packard Enterprise AWS, Pivotal Software, Gemalto, Centrify, Cloudera, Hortonworks",https://energysiren.co.ke/2021/11/13/big-data-security-market-to-eyewitness-massive-growth-by-2029-ibm-hewlett-packard-enterprise-aws-pivotal-software-gemalto-centrify-cloudera-hortonworks/,"Sat, 13 Nov 2021 11:49:55 GMT","Big Data Security Market to Eyewitness Massive Growth by 2029 | IBM, Hewlett Packard Enterprise AWS, Pivotal Software, Gemalto, Centrify, Cloudera, Hortonworks – Energy Siren"
22,"Healthcare Fraud Detection Market Growth In 2021 : Top Key Manufacturers (IBM (US), Optum (US), SAS (US) & More) with Leading Regions and Countries Data",https://energysiren.co.ke/2021/11/13/healthcare-fraud-detection-market-growth-in-2021-top-key-manufacturers-ibm-us-optum-us-sas-us-more-with-leading-regions-and-countries-data/,"Sat, 13 Nov 2021 23:55:16 GMT","Healthcare Fraud Detection Market Growth In 2021 : Top Key Manufacturers (IBM (US), Optum (US), SAS (US) & More) with Leading Regions and Countries Data – Energy Siren"
23,"Asset Performance Management Software Market Global Analysis 2021-2028: IBM, GE Digital, DNV GL, Detechtion Technologies, Siemens, and Many More.",http://energysiren.co.ke/2021/11/13/asset-performance-management-software-market-global-analysis-2021-2028-ibm-ge-digital-dnv-gl-detechtion-technologies-siemens-and-many-more/,"Sat, 13 Nov 2021 15:20:23 GMT","Asset Performance Management Software Market Global Analysis 2021-2028: IBM, GE Digital, DNV GL, Detechtion Technologies, Siemens, and Many More. – Energy Siren"
24,"Open Source Software Market SWOT Analysis including key players Intel, Epson, IBM, Transcend, Oracle, Acquia",https://energysiren.co.ke/2021/11/13/open-source-software-market-swot-analysis-including-key-players-intel-epson-ibm-transcend-oracle-acquia/,"Sat, 13 Nov 2021 18:03:31 GMT","Open Source Software Market SWOT Analysis including key players Intel, Epson, IBM, Transcend, Oracle, Acquia – Energy Siren"
25,"Networking Equipment Market 2028 Top Vendors: Microsoft, IBM, Google, Amazon AWS (Public cloud providers), Cisco",https://energysiren.co.ke/2021/11/13/networking-equipment-market-2028-top-vendors-microsoft-ibm-google-amazon-aws-public-cloud-providers-cisco/,"Sat, 13 Nov 2021 11:43:53 GMT","Networking Equipment Market 2028 Top Vendors: Microsoft, IBM, Google, Amazon AWS (Public cloud providers), Cisco – Energy Siren"
26,"""David Robinson was the most valuable player of the 90s and not Michael Jordan"": According to IBM, the...",https://thesportsrush.com/nba-news-david-robinson-was-the-most-valuable-player-of-the-90s-and-not-michael-jordan-according-to-ibm-the-statistics-give-the-spurs-legend-the-clear-edge/,"Sat, 13 Nov 2021 03:05:19 GMT","""David Robinson was the most valuable player of the 90s and not Michael Jordan"": According to IBM, the..."
27,"Massive Growth of Global Cloud Integration Platform Market by 2028| IBM, Dell Boomi, Oracle, Informatica, SAP, Microsoft Azure, TIBCO Software Inc, Mulesoft, Celigo, Inc, Snaplogic",https://energysiren.co.ke/2021/11/13/massive-growth-of-global-cloud-integration-platform-market-by-2028-ibm-dell-boomi-oracle-informatica-sap-microsoft-azure-tibco-software-inc-mulesoft-celigo-inc-snaplogic/,"Sat, 13 Nov 2021 11:40:48 GMT","Massive Growth of Global Cloud Integration Platform Market by 2028| IBM, Dell Boomi, Oracle, Informatica, SAP, Microsoft Azure, TIBCO Software Inc, Mulesoft, Celigo, Inc, Snaplogic – Energy Siren"
28,"HR Analytics Market Insights, Forecast to 2026 | IBM Corporation, Sage Software, SAP Corporation, Oracle Corporation, Microstrategy Inc., Tableau Software, Crunchr",https://energysiren.co.ke/2021/11/13/hr-analytics-market-insights-forecast-to-2026-ibm-corporation-sage-software-sap-corporation-oracle-corporation-microstrategy-inc-tableau-software-crunchr/,"Sat, 13 Nov 2021 15:28:16 GMT","HR Analytics Market Insights, Forecast to 2026 | IBM Corporation, Sage Software, SAP Corporation, Oracle Corporation, Microstrategy Inc., Tableau Software, Crunchr – Energy Siren"
29,"Quantum Computing in Agriculture Market Size & Revenue Analysis | BOLTZ, IBM, Google",https://energysiren.co.ke/2021/11/13/quantum-computing-in-agriculture-market-size-revenue-analysis-boltz-ibm-google/,"Sat, 13 Nov 2021 12:06:21 GMT","Quantum Computing in Agriculture Market Size & Revenue Analysis | BOLTZ, IBM, Google – Energy Siren"
30,"Embedded Computing Systems (ECSs) Market Size & Revenue Analysis | IBM, Microsoft, Qualcomm, Texas Instruments, Atmel Corporation",https://energysiren.co.ke/2021/11/13/embedded-computing-systems-ecss-market-size-revenue-analysis-ibm-microsoft-qualcomm-texas-instruments-atmel-corporation/,"Sat, 13 Nov 2021 05:54:25 GMT","Embedded Computing Systems (ECSs) Market Size & Revenue Analysis | IBM, Microsoft, Qualcomm, Texas Instruments, Atmel Corporation – Energy Siren"
31,"Financial Management Solution Market SWOT Analysis including key players IBM, Deloitte, Verisk Analytics, SAP",https://energysiren.co.ke/2021/11/13/financial-management-solution-market-swot-analysis-including-key-players-ibm-deloitte-verisk-analytics-sap/,"Sat, 13 Nov 2021 16:22:40 GMT","Financial Management Solution Market SWOT Analysis including key players IBM, Deloitte, Verisk Analytics, SAP – Energy Siren"
32,"Education and Learning Analytics Market In-Depth Analysis including Key Profiles | IBM Corporation, Oracle, Blackboard Inc., Tableau Software, Inc., D2L Corporation, Saba Software, MicroStrategy Inc., and Microsoft.",https://energysiren.co.ke/2021/11/13/education-and-learning-analytics-market-in-depth-analysis-including-key-profiles-ibm-corporation-oracle-blackboard-inc-tableau-software-inc-d2l-corporation-saba-software-microstrategy-inc/,"Sat, 13 Nov 2021 17:39:47 GMT","Education and Learning Analytics Market In-Depth Analysis including Key Profiles | IBM Corporation, Oracle, Blackboard Inc., Tableau Software, Inc., D2L Corporation, Saba Software, MicroStrategy Inc., and Microsoft. – Energy Siren"
33,"IoT Cloud Market 2028 Top Vendors: Amazon (US), IBM Corporation (US) Google Inc. (US), Microsoft Corporation (US), and General Electric (US).",http://energysiren.co.ke/2021/11/13/iot-cloud-market-2028-top-vendors-amazon-u-s-ibm-corporation-u-s-google-inc-u-s-microsoft-corporation-u-s-and-general-electric-u-s/,"Sat, 13 Nov 2021 11:52:30 GMT","IoT Cloud Market 2028 Top Vendors: Amazon (US), IBM Corporation (US) Google Inc. (US), Microsoft Corporation (US), and General Electric (US). – Energy Siren"
34,"Storage Area Network (SAN) Solutions Market Innovative Strategy by 2028 | IBM, Dell, Fujitsu, Oracle",https://energysiren.co.ke/2021/11/13/storage-area-network-san-solutions-market-innovative-strategy-by-2028-ibm-dell-fujitsu-oracle/,"Sat, 13 Nov 2021 05:47:37 GMT","Storage Area Network (SAN) Solutions Market Innovative Strategy by 2028 | IBM, Dell, Fujitsu, Oracle – Energy Siren"
35,"Artificial Intelligence (AI) in Agriculture Market SWOT Analysis by Key Players: IBM, Intel, Microsoft, SAP",https://www.bignewsnetwork.com/news/271717255/artificial-intelligence-ai-in-agriculture-market-swot-analysis-by-key-players-ibm-intel-microsoft-sap,"Sat, 13 Nov 2021 03:19:00 GMT","Artificial Intelligence (AI) in Agriculture Market SWOT Analysis by Key Players: IBM, Intel, Microsoft, SAP"
36,"AI in Financial Asset Management Market is Thriving Worldwide with Genpact, IBM, Infosys, Synechron, Next IT, IPsoft, Lexalytics, Narrative Science.",https://energysiren.co.ke/2021/11/13/ai-in-financial-asset-management-market-is-thriving-worldwide-with-genpact-ibm-infosys-synechron-next-it-ipsoft-lexalytics-narrative-science/,"Sat, 13 Nov 2021 12:50:28 GMT","AI in Financial Asset Management Market is Thriving Worldwide with Genpact, IBM, Infosys, Synechron, Next IT, IPsoft, Lexalytics, Narrative Science. – Energy Siren"
37,"IT Spending in Energy Market Size, Share, Development by 2027| Dell, IBM, Infosys, SAP",https://energysiren.co.ke/2021/11/13/it-spending-in-energy-market-size-share-development-by-2027-dell-ibm-infosys-sap/,"Sat, 13 Nov 2021 05:25:38 GMT","IT Spending in Energy Market Size, Share, Development by 2027| Dell, IBM, Infosys, SAP – Energy Siren"
38,"FinTech Software Market Global Analysis 2021-2028: Microsoft, SAP, Red Hat, IBM, Praxent, and Many More.",https://energysiren.co.ke/2021/11/13/fintech-software-market-global-analysis-2021-2028-microsoft-sap-red-hat-ibm-praxent-and-many-more/,"Sat, 13 Nov 2021 15:25:43 GMT","FinTech Software Market Global Analysis 2021-2028: Microsoft, SAP, Red Hat, IBM, Praxent, and Many More. – Energy Siren"
39,"Data Warehouse As A Service Dwaas Market 2028 Top Vendors: IBM, AWS, Google, Snowflake, Teradata",http://energysiren.co.ke/2021/11/13/data-warehouse-as-a-service-dwaas-market-2028-top-vendors-ibm-aws-google-snowflake-teradata/,"Sat, 13 Nov 2021 07:41:33 GMT","Data Warehouse As A Service Dwaas Market 2028 Top Vendors: IBM, AWS, Google, Snowflake, Teradata – Energy Siren"
40,"Cloud Workflow Market 2028 Top Vendors: SAP, IBM , Appian , Pegasystems , Micro Focus",https://energysiren.co.ke/2021/11/13/cloud-workflow-market-2028-top-vendors-sap-ibm-appian-pegasystems-micro-focus/,"Sat, 13 Nov 2021 08:59:17 GMT","Cloud Workflow Market 2028 Top Vendors: SAP, IBM , Appian , Pegasystems , Micro Focus – Energy Siren"
41,"HCM Software Market Demand In 2021 : Top Key Manufacturers (Oracle, SAP, IBM & More) with Leading Regions and Countries Data",https://energysiren.co.ke/2021/11/13/hcm-software-market-demand-in-2021-top-key-manufacturers-oracle-sap-ibm-more-with-leading-regions-and-countries-data/,"Sat, 13 Nov 2021 05:16:21 GMT","HCM Software Market Demand In 2021 : Top Key Manufacturers (Oracle, SAP, IBM & More) with Leading Regions and Countries Data – Energy Siren"
42,"Medical Publishing Market – increasing demand with Industry Professionals: IBM Corp, John Wiley & Sons Inc, RELX Group Plc, Springer-Verlag GmbH",https://energysiren.co.ke/2021/11/13/medical-publishing-market-increasing-demand-with-industry-professionals-ibm-corp-john-wiley-sons-inc-relx-group-plc-springer-verlag-gmbh/,"Sat, 13 Nov 2021 12:27:48 GMT","Medical Publishing Market – increasing demand with Industry Professionals: IBM Corp, John Wiley & Sons Inc, RELX Group Plc, Springer-Verlag GmbH – Energy Siren"
43,"Facility Management Market May Observe A Giant Move | Key Players - Ibm Corporation, Oracle, Sap, Emcor Group Inc., Aramark India, Fm:Systems",https://energysiren.co.ke/2021/11/13/facility-management-market-may-observe-a-giant-move-key-players-ibm-corporation-oracle-sap-emcor-group-inc-aramark-india-fmsystems/,"Sat, 13 Nov 2021 09:45:23 GMT","Facility Management Market May Observe A Giant Move | Key Players - Ibm Corporation, Oracle, Sap, Emcor Group Inc., Aramark India, Fm:Systems"
44,"Integrated Workplace Management Systems Market 2028 Top Vendors: IBM Corporation (The US), Planon Corporation (The US), Infor (The US), Oracle Corporation (The US), Ioffice Corporation (The US)",http://energysiren.co.ke/2021/11/13/integrated-workplace-management-systems-market-2028-top-vendors-ibm-corporation-the-u-s-planon-corporation-the-u-s-infor-the-u-s-oracle-corporation-the-u-s-ioffice-corporation-the-u/,"Sat, 13 Nov 2021 11:36:25 GMT","Integrated Workplace Management Systems Market 2028 Top Vendors: IBM Corporation (The US), Planon Corporation (The US), Infor (The US), Oracle Corporation (The US), Ioffice Corporation (The US) – Energy Siren"
45,"Call Center Outsourcing Market is Thriving Worldwide with IBM Global Services, Xerox Corporation, CGS, Datamark, Inc., Infinit Contact, Five9, Runway, Invensis, Infinit-O, PSI, Sitel Worldwide Corporation",https://energysiren.co.ke/2021/11/13/call-center-outsourcing-market-is-thriving-worldwide-with-ibm-global-services-xerox-corporation-cgs-datamark-inc-infinit-contact-five9-runway-invensis-infinit-o-psi-sitel-worldwide-corpora/,"Sat, 13 Nov 2021 13:00:37 GMT","Call Center Outsourcing Market is Thriving Worldwide with IBM Global Services, Xerox Corporation, CGS, Datamark, Inc., Infinit Contact, Five9, Runway, Invensis, Infinit-O, PSI, Sitel Worldwide Corporation – Energy Siren"
46,"Mainframe Computers Market Future Developments and Vendors Analysis Report - IBM (USA), Unisys (USA), Fujitsu (JP),",https://energysiren.co.ke/2021/11/13/mainframe-computers-market-future-developments-and-vendors-analysis-report-ibm-usa-unisys-usa-fujitsu-jp/,"Sat, 13 Nov 2021 10:00:22 GMT","Mainframe Computers Market Future Developments and Vendors Analysis Report - IBM (USA), Unisys (USA), Fujitsu (JP),"
47,"Business Management Consulting Market Global Analysis 2021-2028: IBM Global Business Service, Booz Allen Hamilton, PwC, Accenture, The Boston Consulting Group, and Many More.",http://energysiren.co.ke/2021/11/13/business-management-consulting-market-global-analysis-2021-2028-ibm-global-business-service-booz-allen-hamilton-pwc-accenture-the-boston-consulting-group-and-many-more/,"Sat, 13 Nov 2021 13:22:52 GMT","Business Management Consulting Market Global Analysis 2021-2028: IBM Global Business Service, Booz Allen Hamilton, PwC, Accenture, The Boston Consulting Group, and Many More. – Energy Siren"
48,"Broadcast And Media Technology Market 2028 Top Vendors: Evertz Technologies, IBM, Quantum, ROHDE?SCHWARZ, Dell",https://energysiren.co.ke/2021/11/13/broadcast-and-media-technology-market-2028-top-vendors-evertz-technologies-ibm-quantum-rohdeschwarz-dell/,"Sat, 13 Nov 2021 10:15:21 GMT","Broadcast And Media Technology Market 2028 Top Vendors: Evertz Technologies, IBM, Quantum, ROHDE?SCHWARZ, Dell – Energy Siren"
49,"Master Data Management Market Rewriting Long Term Growth Story | IBM, Oracle, SAP, SAS Institute, TIBCO, Informatica, Talend, Cloudera, Riversand, SynForce",https://energysiren.co.ke/2021/11/13/master-data-management-market-rewriting-long-term-growth-story-ibm-oracle-sap-sas-institute-tibco-informatica-talend-cloudera-riversand-synforce/,"Sat, 13 Nov 2021 22:18:45 GMT","Master Data Management Market Rewriting Long Term Growth Story | IBM, Oracle, SAP, SAS Institute, TIBCO, Informatica, Talend, Cloudera, Riversand, SynForce – Energy Siren"
50,Digital rights management in the open seas of blockchain systems By Cointelegraph,https://www.investing.com/news/cryptocurrency-news/digital-rights-management-in-the-open-seas-of-blockchain-systems-2678727,"Sat, 13 Nov 2021 17:00:00 GMT",Digital rights management in the open seas of blockchain systems By Cointelegraph
51,"Indirect Procurement BPO Market Global Analysis 2021-2028: IBM, Capgemini, Accenture, TCS, WNS, Genpact, Wipro, Infosys, Corbus, Xchanging, etc.",http://energysiren.co.ke/2021/11/13/indirect-procurement-bpo-market-global-analysis-2021-2028-ibm-capgemini-accenture-tcs-wns-genpact-wipro-infosys-corbus-xchanging-etc/,"Sat, 13 Nov 2021 12:06:37 GMT","Indirect Procurement BPO Market Global Analysis 2021-2028: IBM, Capgemini, Accenture, TCS, WNS, Genpact, Wipro, Infosys, Corbus, Xchanging, etc. – Energy Siren"
52,"Credit Risk Management Platform Market Demand In 2021 : Top Key Manufacturers (IBM, Oracle, SAP & More) with Leading Regions and Countries Data",https://energysiren.co.ke/2021/11/13/credit-risk-management-platform-market-demand-in-2021-top-key-manufacturers-ibm-oracle-sap-more-with-leading-regions-and-countries-data/,"Sat, 13 Nov 2021 15:53:23 GMT","Credit Risk Management Platform Market Demand In 2021 : Top Key Manufacturers (IBM, Oracle, SAP & More) with Leading Regions and Countries Data – Energy Siren"
53,"Global Connected Logistics Market Growth, Overview with Detailed Analysis 2021-2027| IBM, Oracle, SAP, Cisco System, Eurotech, Securerf, GT Nexus, and more",https://energysiren.co.ke/2021/11/13/global-connected-logistics-market-growth-overview-with-detailed-analysis-2021-2027-ibm-oracle-sap-cisco-system-eurotech-securerf-gt-nexus-and-more/,"Sat, 13 Nov 2021 11:10:59 GMT","Global Connected Logistics Market Growth, Overview with Detailed Analysis 2021-2027| IBM, Oracle, SAP, Cisco System, Eurotech, Securerf, GT Nexus, and more – Energy Siren"
54,"Fixed Data Connectivity Market Global Analysis 2021-2028: Ebay, Lenovo, Intel, IBM, Amazone, and Many More.",http://energysiren.co.ke/2021/11/13/fixed-data-connectivity-market-global-analysis-2021-2028-ebay-lenovo-intel-ibm-amazone-and-many-more/,"Sat, 13 Nov 2021 14:43:51 GMT","Fixed Data Connectivity Market Global Analysis 2021-2028: Ebay, Lenovo, Intel, IBM, Amazone, and Many More. – Energy Siren"
55,"Blockchain Market to Witness Astonishing Growth– 2028| IBM, AWS, Microsoft, SAP , Intel, Oracle, Bitfury, Cegeka, Earthport, Guardtime, Digital Asset Holdings, Chain, Huawei",http://energysiren.co.ke/2021/11/13/blockchain-market-to-witness-astonishing-growth-2028-ibm-aws-microsoft-sap-intel-oracle-bitfury-cegeka-earthport-guardtime-digital-asset-holdings-chain-huawei/,"Sat, 13 Nov 2021 04:09:56 GMT","Blockchain Market to Witness Astonishing Growth– 2028| IBM, AWS, Microsoft, SAP , Intel, Oracle, Bitfury, Cegeka, Earthport, Guardtime, Digital Asset Holdings, Chain, Huawei – Energy Siren"
