,title,link,pubDate,description
56,"Global Big Data in Automotive Market 2021 Size, Demand and Forecast 2029| Top Player: Accenture, Adobe Systems, Capgemini, Deloitte, DXC Technology, Ericsson, Happiest Minds, HCL Technologies, IBM",https://energysiren.co.ke/2021/11/13/global-big-data-in-automotive-market-2021-size-demand-and-forecast-2029-top-player-accenture-adobe-systems-capgemini-deloitte-dxc-technology-ericsson-happiest-minds-hcl-technologies-ibm/,"Sat, 13 Nov 2021 10:30:46 GMT","Global Big Data in Automotive Market 2021 Size, Demand and Forecast 2029| Top Player: Accenture, Adobe Systems, Capgemini, Deloitte, DXC Technology, Ericsson, Happiest Minds, HCL Technologies, IBM – Energy Siren"
57,"Digital Twin Market 2028 Top Vendors: IBM Corporation, ABB Group, Oracle Corporation, ANSYS, Inc.",https://energysiren.co.ke/2021/11/13/digital-twin-market-2028-top-vendors-ibm-corporation-abb-group-oracle-corporation-ansys-inc/,"Sat, 13 Nov 2021 11:32:19 GMT","Digital Twin Market 2028 Top Vendors: IBM Corporation, ABB Group, Oracle Corporation, ANSYS, Inc. – Energy Siren"
58,"AI in Telecommunication Market Opportunity,Analytical Insights – IBM,Microsoft,Intel,AT&T,Cisco Systems,Nuance Communications,H2O.ai,Salesforce",https://energysiren.co.ke/2021/11/13/ai-in-telecommunication-market-opportunityanalytical-insights-ibmmicrosoftintelattcisco-systemsnuance-communicationsh2o-aisalesforce/,"Sat, 13 Nov 2021 05:54:17 GMT","AI in Telecommunication Market Opportunity,Analytical Insights – IBM,Microsoft,Intel,AT&T,Cisco Systems,Nuance Communications,H2O.ai,Salesforce – Energy Siren"
59,"Deep Packet Inspection and Processing Market 2021-2027 Global Industry Analysis| IBM, Cisco Systems, Extreme Networks, Juniper Networks, Symantec, SolarWinds",https://energysiren.co.ke/2021/11/13/deep-packet-inspection-and-processing-market-2021-2027-global-industry-analysis-ibm-cisco-systems-extreme-networks-juniper-networks-symantec-solarwinds/,"Sat, 13 Nov 2021 17:36:10 GMT","Deep Packet Inspection and Processing Market 2021-2027 Global Industry Analysis| IBM, Cisco Systems, Extreme Networks, Juniper Networks, Symantec, SolarWinds – Energy Siren"
60,"Portable Storage Device Control Software Market increasing demand with key players | IBM, Hitachi, McAfeeMcAfee",https://energysiren.co.ke/2021/11/13/portable-storage-device-control-software/,"Sat, 13 Nov 2021 09:32:59 GMT","Portable Storage Device Control Software Market increasing demand with key players | IBM, Hitachi, McAfeeMcAfee – Energy Siren"
61,A Primer On Quantum Computing For Investors,https://seekingalpha.com/article/4469128-hon-ibm-ionq-sniia-primer-on-quantum-computing-for-investors,"Sat, 13 Nov 2021 03:43:00 GMT",A Primer On Quantum Computing For Investors
62,"Document Analysis Market 2028 Top Vendors: AntWorks, IBM, ABBYY, Extract Systems, HCL Technologies",http://energysiren.co.ke/2021/11/13/document-analysis-market-2028-top-vendors-antworks-ibm-abbyy-extract-systems-hcl-technologies/,"Sat, 13 Nov 2021 08:33:51 GMT","Document Analysis Market 2028 Top Vendors: AntWorks, IBM, ABBYY, Extract Systems, HCL Technologies"
63,"Data Deduplication Tools Market Impact and Recovery Analysis Report 2021-2028: IBM ProtecTier, Microsoft DPM, Dell EMC, Fujitsu, Hitachi, DQ Global, StrategicDB, Quantum Corporation",https://energysiren.co.ke/2021/11/13/data-deduplication-tools-market-impact-and-recovery-analysis-report-2021-2028-ibm-protectier-microsoft-dpm-dell-emc-fujitsu-hitachi-dq-global-strategicdb-quantum-corporation/,"Sat, 13 Nov 2021 04:43:06 GMT","Data Deduplication Tools Market Impact and Recovery Analysis Report 2021-2028: IBM ProtecTier, Microsoft DPM, Dell EMC, Fujitsu, Hitachi, DQ Global, StrategicDB, Quantum Corporation – Energy Siren"
64,"Augmented Analytics Software and Platforms Market Opportunity,Analytical Insights – AnswerRocket,IBM,Microsoft,Oracle,Pyramid Analytics,Qlik",https://energysiren.co.ke/2021/11/13/augmented-analytics-software-and-platforms-market-opportunityanalytical-insights-answerrocketibmmicrosoftoraclepyramid-analyticsqlik/,"Sat, 13 Nov 2021 06:11:13 GMT","Augmented Analytics Software and Platforms Market Opportunity,Analytical Insights – AnswerRocket,IBM,Microsoft,Oracle,Pyramid Analytics,Qlik – Energy Siren"
65,"Multi-Cloud Security Solutions Market In-Depth Analysis including key players HashiCorp, IBM, JD Cloud, F5 Networks",https://energysiren.co.ke/2021/11/13/multi-cloud-security-solutions-market-in-depth-analysis-including-key-players-hashicorp-ibm-jd-cloud-f5-networks/,"Sat, 13 Nov 2021 11:25:38 GMT","Multi-Cloud Security Solutions Market In-Depth Analysis including key players HashiCorp, IBM, JD Cloud, F5 Networks – Energy Siren"
66,"Text Analysis Software Market Future Scope including key players Microsoft, IBM, QSR International",https://liverpoolstudentmedia.com/uncategorised/421790/text-analysis-software-market-future-scope-including-key-players-microsoft-ibm-qsr-international/,"Sat, 13 Nov 2021 18:34:31 GMT","Text Analysis Software Market Future Scope including key players Microsoft, IBM, QSR International – LSMedia"
67,"AI Platforms Software Market Future Scope including key players Microsoft, Google, IBM",https://liverpoolstudentmedia.com/uncategorised/421789/ai-platforms-software-market-future-scope-including-key-players-microsoft-google-ibm/,"Sat, 13 Nov 2021 18:34:39 GMT","AI Platforms Software Market Future Scope including key players Microsoft, Google, IBM – LSMedia"
68,"Photonic Integrated Circuit (IC) and Quantum Computing Market Global Analysis 2021-2028: Aofptec, Alcatel-Lucent, Broadcom, IBM, Hamamatsu Photonics, and Many More.",https://energysiren.co.ke/2021/11/13/photonic-integrated-circuit-ic-and-quantum-computing-market-global-analysis-2021-2028-aofptec-alcatel-lucent-broadcom-ibm-hamamatsu-photonics-and-many-more/,"Sat, 13 Nov 2021 13:40:57 GMT","Photonic Integrated Circuit (IC) and Quantum Computing Market Global Analysis 2021-2028: Aofptec, Alcatel-Lucent, Broadcom, IBM, Hamamatsu Photonics, and Many More. – Energy Siren"
69,"Mobile Threat Management Security Software Market Top Players Analysis: IBM Corporation, SAP AG, Intel Corporation, Cisco Systems, Absolute Software Corporation, Microsoft Corporation, MobileIron, Dell, BullGaurd, Symantec Corporation, LANDesk Soft",https://liverpoolstudentmedia.com/space/415565/mobile-threat-management-security-software-market-top-players-analysis-ibm-corporation-sap-ag-intel-corporation-cisco-systems-absolute-software-corporation-microsoft-corporation-mobileiron-del/,"Sat, 13 Nov 2021 18:59:45 GMT","Mobile Threat Management Security Software Market Top Players Analysis: IBM Corporation, SAP AG, Intel Corporation, Cisco Systems, Absolute Software Corporation, Microsoft Corporation, MobileIron, Dell, BullGaurd, Symantec Corporation, LANDesk Soft"
70,"Security Incident Managements Market Future Scope including key players IBM, Cisco Systems, Intel",https://liverpoolstudentmedia.com/uncategorised/421648/security-incident-managements-market-future-scope-including-key-players-ibm-cisco-systems-intel/,"Sat, 13 Nov 2021 18:25:18 GMT","Security Incident Managements Market Future Scope including key players IBM, Cisco Systems, Intel – LSMedia"
71,"Modular Data Center Market Share In 2021 : Top Key Manufacturers (HP Inc., IBM Corporation., Dell Inc. & More) with Leading Regions and Countries Data",https://energysiren.co.ke/2021/11/13/modular-data-center-market-share-in-2021-top-key-manufacturers-hp-inc-ibm-corporation-dell-inc-more-with-leading-regions-and-countries-data/,"Sat, 13 Nov 2021 15:40:28 GMT","Modular Data Center Market Share In 2021 : Top Key Manufacturers (HP Inc., IBM Corporation., Dell Inc. & More) with Leading Regions and Countries Data – Energy Siren"
72,"Affective Computing Market Size,Forecast,and Top Firms – IBM,Microsoft,Eyesight Technologies,Affectiva,NuraLogix,gestigon GmbH,Crowd Emotion",https://energysiren.co.ke/2021/11/13/affective-computing-market-sizeforecastand-top-firms-ibmmicrosofteyesight-technologiesaffectivanuralogixgestigon-gmbhcrowd-emotion/,"Sat, 13 Nov 2021 05:56:20 GMT","Affective Computing Market Size,Forecast,and Top Firms – IBM,Microsoft,Eyesight Technologies,Affectiva,NuraLogix,gestigon GmbH,Crowd Emotion – Energy Siren"
73,"Procurement Contract Management Market Share In 2021 : Top Key Manufacturers (SAP Ariba, IBM, Concord & More) with Leading Regions and Countries Data",https://energysiren.co.ke/2021/11/13/procurement-contract-management-market-share-in-2021-top-key-manufacturers-sap-ariba-ibm-concord-more-with-leading-regions-and-countries-data/,"Sat, 13 Nov 2021 13:47:11 GMT","Procurement Contract Management Market Share In 2021 : Top Key Manufacturers (SAP Ariba, IBM, Concord & More) with Leading Regions and Countries Data – Energy Siren"
74,"Intranet Security Market Is Booming Worldwide | Symantec, Intel Security, IBM",https://liverpoolstudentmedia.com/news/416752/intranet-security-market-is-booming-worldwide-symantec-intel-security-ibm/,"Sat, 13 Nov 2021 15:05:24 GMT","Intranet Security Market Is Booming Worldwide | Symantec, Intel Security, IBM – LSMedia"
75,"Government Service Cloud Market Top Players Analysis: Microsoft, IBM, Google, IBM, Oracle, Salesforce, Cisco Systems, Dell Technologies, VMware, Verizon, CGI Group,",https://liverpoolstudentmedia.com/business/408057/government-service-cloud-market-top-players-analysis-microsoft-ibm-google-ibm-oracle-salesforce-cisco-systems-dell-technologies-vmware-verizon-cgi-group/,"Sat, 13 Nov 2021 11:17:49 GMT","Government Service Cloud Market Top Players Analysis: Microsoft, IBM, Google, IBM, Oracle, Salesforce, Cisco Systems, Dell Technologies, VMware, Verizon, CGI Group, – LSMedia"
76,"Proactive Security Market including top key players IBM, Cisco, Symantec, Fireeye",https://liverpoolstudentmedia.com/news/416749/proactive-security-market-including-top-key-players-ibm-cisco-symantec-fireeye/,"Sat, 13 Nov 2021 15:05:24 GMT","Proactive Security Market including top key players IBM, Cisco, Symantec, Fireeye – LSMedia"
77,"Fog Networking Market Quality & Quantity Analysis | ARM, Cisco, Dell, Ericsson, HP, IBM, Intel",https://energysiren.co.ke/2021/11/13/fog-networking-market-quality-quantity-analysis-arm-cisco-dell-ericsson-hp-ibm-intel/,"Sat, 13 Nov 2021 05:52:26 GMT","Fog Networking Market Quality & Quantity Analysis | ARM, Cisco, Dell, Ericsson, HP, IBM, Intel – Energy Siren"
78,"Natural Language Understanding (NLU) Software Market Top Players Analysis: IBM, Amazon AWS, Progress Software, Taiger, Linguamatics, Health Fidelity, Microsoft Corporation, AX Semantics, Wordsmith, SAS, Article Forge, Quill",https://liverpoolstudentmedia.com/policy/416557/natural-language-understanding-nlu-software-market-top-players-analysis-ibm-amazon-aws-progress-software-taiger-linguamatics-health-fidelity-microsoft-corporation-ax-semantics-wordsmith-sa/,"Sat, 13 Nov 2021 14:50:03 GMT","Natural Language Understanding (NLU) Software Market Top Players Analysis: IBM, Amazon AWS, Progress Software, Taiger, Linguamatics, Health Fidelity, Microsoft Corporation, AX Semantics, Wordsmith, SAS, Article Forge, Quill – LSMedia"
79,"Homeland Security Market | Industry Analysis ,Size, share ,Leading Players, Key players IBM Corporation , Raytheon Covid-19 Impact, Competition and Forecast 2027 | MMR",https://liverpoolstudentmedia.com/news/409695/homeland-security-market-industry-analysis-size-share-leading-players-key-players-ibm-corporation-raytheon-covid-19-impact-competition-and-forecast-2027-mmr/,"Sat, 13 Nov 2021 12:28:42 GMT","Homeland Security Market | Industry Analysis ,Size, share ,Leading Players, Key players IBM Corporation , Raytheon Covid-19 Impact, Competition and Forecast 2027 | MMR – LSMedia"
80,"Customer Identity Access Management (CIAM) Market to Witness Huge Growth by 2028 | Microsoft, SAP, IBM, Ping Identity, Okta, Oracle",https://energysiren.co.ke/2021/11/13/customer-identity-access-management-ciam-market-to-witness-huge-growth-by-2028-microsoft-sap-ibm-ping-identity-okta-oracle/,"Sat, 13 Nov 2021 12:13:25 GMT","Customer Identity Access Management (CIAM) Market to Witness Huge Growth by 2028 | Microsoft, SAP, IBM, Ping Identity, Okta, Oracle – Energy Siren"
81,"Smart Space Market 2028 Top Vendors: IBM (US), ABB (Switzerland), Cisco (US), Siemens (Germany), Huawei (China)",https://liverpoolstudentmedia.com/music-news/398565/smart-space-market-2028-top-vendors-ibm-us-abb-switzerland-cisco-us-siemens-germany-huawei-china/,"Sat, 13 Nov 2021 07:35:39 GMT","Smart Space Market 2028 Top Vendors: IBM (US), ABB (Switzerland), Cisco (US), Siemens (Germany), Huawei (China) – LSMedia"
82,"Cloud ERP Software Market to Eyewitness Massive Growth by 2028: SAP, Oracle, Sage, Infor, Microsoft, Epicor, Kronos, Concur(SAP), Ibm",https://energysiren.co.ke/2021/11/13/cloud-erp-software-market-to-eyewitness-massive-growth-by-2028-sap-oracle-sage-infor-microsoft-epicor-kronos-concursap-ibm/,"Sat, 13 Nov 2021 12:32:18 GMT","Cloud ERP Software Market to Eyewitness Massive Growth by 2028: SAP, Oracle, Sage, Infor, Microsoft, Epicor, Kronos, Concur(SAP), Ibm – Energy Siren"
83,"Applicant Tracking System Tools Market May See Big Move | Jobvite, TalentReef, IBM",https://liverpoolstudentmedia.com/news/395727/applicant-tracking-system-tools-market-may-see-big-move-jobvite-talentreef-ibm/,"Sat, 13 Nov 2021 06:09:12 GMT","Applicant Tracking System Tools Market May See Big Move | Jobvite, TalentReef, IBM – LSMedia"
84,"Block Chain Market Top Players Analysis: IBM, Abra, Microsoft, Accenture, AlphaPoint, Intel, BTL Group, Microsoft Corporation, Deloitte, Amazon Web Services, Earthport",https://liverpoolstudentmedia.com/nasa/414000/block-chain-market-top-players-analysis-ibm-abra-microsoft-accenture-alphapoint-intel-btl-group-microsoft-corporation-deloitte-amazon-web-services-earthport/,"Sat, 13 Nov 2021 13:34:07 GMT","Block Chain Market Top Players Analysis: IBM, Abra, Microsoft, Accenture, AlphaPoint, Intel, BTL Group, Microsoft Corporation, Deloitte, Amazon Web Services, Earthport – LSMedia"
85,"Bare Metal Cloud Service Market Scope In 2021 : Top Key Manufacturers (IBM Corporation, Oracle Corporation, Scaleway & More) with Leading Regions and Countries Data",https://liverpoolstudentmedia.com/uncategorised/408689/bare-metal-cloud-service-market-scope-in-2021-top-key-manufacturers-ibm-corporation-oracle-corporation-scaleway-more-with-leading-regions-and-countries-data/,"Sat, 13 Nov 2021 11:32:55 GMT","Bare Metal Cloud Service Market Scope In 2021 : Top Key Manufacturers (IBM Corporation, Oracle Corporation, Scaleway & More) with Leading Regions and Countries Data – LSMedia"
86,"Healthcare Prescriptive Analytics Market to Witness Huge Growth by 2028 | Allscripts, Cerner, IBM, McKesson",https://energysiren.co.ke/2021/11/13/healthcare-prescriptive-analytics-market-to-witness-huge-growth-by-2028-allscripts-cerner-ibm-mckesson/,"Sat, 13 Nov 2021 04:57:51 GMT","Healthcare Prescriptive Analytics Market to Witness Huge Growth by 2028 | Allscripts, Cerner, IBM, McKesson – Energy Siren"
87,"AI Open Platform Market Top Players Analysis: Microsoft, Google, Salesforce, IBM, Intel, Amazon Web Services, HPE, Ayasdi, Qualcomm, Jingdong, Alibaba, Huawei, Baidu, Tencent, Jinshan,",https://liverpoolstudentmedia.com/finance/405007/ai-open-platform-market-top-players-analysis-microsoft-google-salesforce-ibm-intel-amazon-web-services-hpe-ayasdi-qualcomm-jingdong-alibaba-huawei-baidu-tencent-jinshan/,"Sat, 13 Nov 2021 10:07:10 GMT","AI Open Platform Market Top Players Analysis: Microsoft, Google, Salesforce, IBM, Intel, Amazon Web Services, HPE, Ayasdi, Qualcomm, Jingdong, Alibaba, Huawei, Baidu, Tencent, Jinshan, – LSMedia"
88,"AI Chatbots Market Top Players Analysis: IBM, Kore.ai, Nuance Communications, [24]7.ai, Inbenta, Google, AIVO, LogMeIn, AWS, Gupshup, SmartBots.ai, Yellow Messenger, Chatfuel, CogniCor Technologies, Passage AI",https://liverpoolstudentmedia.com/finance/414152/ai-chatbots-market-top-players-analysis-ibm-kore-ai-nuance-communications-247-ai-inbenta-google-aivo-logmein-aws-gupshup-smartbots-ai-yellow-messenger-chatfuel-cognicor-technologies-p/,"Sat, 13 Nov 2021 13:39:16 GMT","AI Chatbots Market Top Players Analysis: IBM, Kore.ai, Nuance Communications, [24]7.ai, Inbenta, Google, AIVO, LogMeIn, AWS, Gupshup, SmartBots.ai, Yellow Messenger, Chatfuel, CogniCor Technologies, Passage AI – LSMedia"
89,"Bioinformatics Software and Services Market including top key players Cisco, IBM, GE Healthcare, Microsoft, SAP, Medtronic",https://liverpoolstudentmedia.com/uncategorised/393427/bioinformatics-software-and-services-market-including-top-key-players-cisco-ibm-ge-healthcare-microsoft-sap-medtronic/,"Sat, 13 Nov 2021 04:47:11 GMT","Bioinformatics Software and Services Market including top key players Cisco, IBM, GE Healthcare, Microsoft, SAP, Medtronic – LSMedia"
90,"Intelligent Apps Market 2028 Top Vendors: IBM, Google, AWS, Microsoft, Salesforce",https://liverpoolstudentmedia.com/energy/398144/intelligent-apps-market-2028-top-vendors-ibm-google-aws-microsoft-salesforce/,"Sat, 13 Nov 2021 07:20:27 GMT","Intelligent Apps Market 2028 Top Vendors: IBM, Google, AWS, Microsoft, Salesforce – LSMedia"
91,"Machine Learning Market | Top Players Analysis Intel Corporation, IBM Corporation, KNIME.com AG , RapidMiner, Inc.,H2O.ai.",https://liverpoolstudentmedia.com/news/409941/machine-learning-market-top-players-analysis-intel-corporation-ibm-corporation-knime-com-ag-rapidminer-inc-h2o-ai/,"Sat, 13 Nov 2021 12:08:18 GMT","Machine Learning Market | Top Players Analysis Intel Corporation, IBM Corporation, KNIME.com AG , RapidMiner, Inc.,H2O.ai. – LSMedia"
92,"IoT Platforms Software Market In-Depth Analysis including key players IBM, GE Digital, Microsoft, SAP, PTC, AWS, AylaNetworks, HPE, Oracle",https://liverpoolstudentmedia.com/news/407093/iot-platforms-software-market-in-depth-analysis-including-key-players-ibm-ge-digital-microsoft-sap-ptc-aws-aylanetworks-hpe-oracle/,"Sat, 13 Nov 2021 10:52:40 GMT","IoT Platforms Software Market In-Depth Analysis including key players IBM, GE Digital, Microsoft, SAP, PTC, AWS, AylaNetworks, HPE, Oracle – LSMedia"
93,"Device Vulnerability Management Market Top Players Analysis: IBM, GFI Software, Splunk, HPE, McAfee, Dell, Tripwire, Subtotal, Qualys, Rapid7, EMC, NetIQ, Symantec Corporation",https://liverpoolstudentmedia.com/uk/415234/device-vulnerability-management-market-top-players-analysis-ibm-gfi-software-splunk-hpe-mcafee-dell-tripwire-subtotal-qualys-rapid7-emc-netiq-symantec-corporation/,"Sat, 13 Nov 2021 14:14:30 GMT","Device Vulnerability Management Market Top Players Analysis: IBM, GFI Software, Splunk, HPE, McAfee, Dell, Tripwire, Subtotal, Qualys, Rapid7, EMC, NetIQ, Symantec Corporation – LSMedia"
94,"Healthcare Analytics Solutions Market – increasing demand with Industry Professionals: IBM, OptumHealth, Oracle",https://liverpoolstudentmedia.com/arts/414585/healthcare-analytics-solutions-market-increasing-demand-with-industry-professionals-ibm-optumhealth-oracle/,"Sat, 13 Nov 2021 13:54:25 GMT","Healthcare Analytics Solutions Market – increasing demand with Industry Professionals: IBM, OptumHealth, Oracle – LSMedia"
95,"MES Software Market Top Players Analysis: SAP, IBM, Infor, Oracle, Epicor, Sage, Workday, Kronos, Microsoft, Totvs, Digiwin, UNIT4, Kingdee, YonYou, Cornerstone",https://liverpoolstudentmedia.com/uncategorised/415978/mes-software-market-top-players-analysis-sap-ibm-infor-oracle-epicor-sage-workday-kronos-microsoft-totvs-digiwin-unit4-kingdee-yonyou-cornerstone/,"Sat, 13 Nov 2021 14:34:39 GMT","MES Software Market Top Players Analysis: SAP, IBM, Infor, Oracle, Epicor, Sage, Workday, Kronos, Microsoft, Totvs, Digiwin, UNIT4, Kingdee, YonYou, Cornerstone – LSMedia"
96,"Enterprise Collaboration Market 2028 Top Manufacturers List: IBM, Microsoft, VMware, Atlassian, Cisco Systems",https://liverpoolstudentmedia.com/business/403567/enterprise-collaboration-market-2028-top-manufacturers-list-ibm-microsoft-vmware-atlassian-cisco-systems/,"Sat, 13 Nov 2021 09:29:49 GMT","Enterprise Collaboration Market 2028 Top Manufacturers List: IBM, Microsoft, VMware, Atlassian, Cisco Systems – LSMedia"
97,"Graph Database Market In-Depth Analysis including key players IBM, Microsoft, Oracle, AWS, Neo4j, Orientdb, Teradata",https://liverpoolstudentmedia.com/uncategorised/411009/graph-database-market-in-depth-analysis-including-key-players-ibm-microsoft-oracle-aws-neo4j-orientdb-teradata/,"Sat, 13 Nov 2021 12:58:54 GMT","Graph Database Market In-Depth Analysis including key players IBM, Microsoft, Oracle, AWS, Neo4j, Orientdb, Teradata – LSMedia"
98,"Artificial Intelligence In Healthcare Service Market Top Players Analysis: IBM, Microsoft, Enlitic, Arterys, Atomwise, Freenome, Butterfly Network, Jvion, Apixio, Roche(Flatiron Health), Ayasdi, Welltok,",https://liverpoolstudentmedia.com/technology/406506/artificial-intelligence-in-healthcare-service-market-top-players-analysis-ibm-microsoft-enlitic-arterys-atomwise-freenome-butterfly-network-jvion-apixio-rocheflatiron-health-ayasdi-wellt/,"Sat, 13 Nov 2021 10:37:26 GMT","Artificial Intelligence In Healthcare Service Market Top Players Analysis: IBM, Microsoft, Enlitic, Arterys, Atomwise, Freenome, Butterfly Network, Jvion, Apixio, Roche(Flatiron Health), Ayasdi, Welltok, – LSMedia"
99,"Blockchain in Automotive Aerospace Market Top Players Analysis: IBM, Ripple, Microsoft, Amazon, R3, Accenture, Consensys Systems, BTL Group, Bitfury Group, Ethereum Foundation",https://liverpoolstudentmedia.com/world/415612/blockchain-in-automotive-aerospace-market-top-players-analysis-ibm-ripple-microsoft-amazon-r3-accenture-consensys-systems-btl-group-bitfury-group-ethereum-foundation/,"Sat, 13 Nov 2021 14:24:35 GMT","Blockchain in Automotive Aerospace Market Top Players Analysis: IBM, Ripple, Microsoft, Amazon, R3, Accenture, Consensys Systems, BTL Group, Bitfury Group, Ethereum Foundation – LSMedia"
